{"schemaVersion":"1.0.0","artifactType":"measurement-plan","proposalOnly":true,"sourceDigests":["sha256:aaaaaaaaaaaaaaaaaaaaaaaaaaaaaaaaaaaaaaaaaaaaaaaaaaaaaaaaaaaaaaaa"],"upstreamArtifactDigests":["sha256:9658013d0b41238ff39baf68fee6404902deba14e098324988492151074715a0"],"data":{"metricDefinitions":[{"metricId":"review-completion-rate","numerator":"Count of synthetic completed reviews.","denominator":"Count of synthetic requested reviews.","windowDays":30,"privacyFloor":10,"lineageEvidenceDigest":"sha256:aaaaaaaaaaaaaaaaaaaaaaaaaaaaaaaaaaaaaaaaaaaaaaaaaaaaaaaaaaaaaaaa"}]}}
